{
  "$schema": "./schema/config.schema.json",
  "gitFlow": false,
  "changelog": { "dateLocale": "en-US", "path": "CHANGELOG.md" },
  "tag": { "prefix": "v", "deleteIfExists": true },
  "allowReleaseFrom": ["main"],
  "github": { "release": false },
  "hooks": { "beforeRelease": [], "afterBump": [], "afterRelease": [] }
}
